artifact,hash,updated_at,owner,buildkite_run,notes,device_lab_capacity_pct
android-and6-security-target-v0.1,385d17a55579d2b0b365e21090ee081ded79e44655690b2abfbf54068c9b55b0,2026-02-12,Sofia Martins,n/a,"Initial ETSI EN 319 401 security target published at docs/source/compliance/android/eu/security_target.md.",NA
android-and6-gdpr-dpia-20260212,8ef338a20104dc5d15094e28a1332a604b68bdcfef1ff82fea784d43fdbd10b5,2026-02-12,SRE Privacy Lead,n/a,"GDPR DPIA summary for Android telemetry stored at docs/source/compliance/android/eu/gdpr_dpia_summary.md.",NA
android-and6-sbom-attestation-0.9.0,c2e0de176d4bb8c8e09329e2b9ee5dd93228d3f0def78225c1d8b777a5613f2d,2026-02-11,Release Engineering,android-sdk-release#4821,"CycloneDX SBOM + Sigstore bundle process documented at docs/source/compliance/android/eu/sbom_attestation.md.",NA
android-and6-fisc-checklist-v0.1,2d8b4c90c94dddd8118fcb9c55f07c25000c6dab1f8d239570402023ab89e844,2026-02-12,Daniel Park,n/a,"FISC mapping recorded at docs/source/compliance/android/jp/fisc_controls_checklist.md.",NA
android-strongbox-attestation-20260213,8b8cc2e9de0c4183b51d011f5106a62b212da620d628cfc3b1cb74fe500b95b2,2026-02-13,Hardware Lab Lead,"android-strongbox-attestation#219,#221","JP StrongBox bundle summary updated after Pixel 8 Pro retest + Galaxy S24 capture (docs/source/compliance/android/jp/strongbox_attestation.md).",85
android-device-lab-failover-20260220,faf32356dfc0bbca1459b14d75f3306ea1c10cb40f3180fe1758ac5105016f85,2026-04-15,Device Lab Ops,"android-strongbox-attestation#245;android-ci-e2e#612","DR-2026-02-Q1 failover drill evidence bundle at artifacts/android/device_lab_contingency/20260220-failover-drill/ with ticket AND6-DR-202602 + Legal/Compliance ACK logged.",82
